{
  "id": "HN-KNOW-CMD-JOURNAL",
  "title": "WORKSPACE/Journal.md",
  "domain": "operational history",
  "owner": "HOUSE_NET_OWNER",
  "status": "draft",
  "source": {
    "type": "repository",
    "uri": "repo://HouseNet-Projects/house-net-command-center/WORKSPACE/Journal.md@9e15dd1c00f8c9a5c4a531fa45e7b4c99fce6b8f",
    "hash": "77c77e6fa4abc06435b7cf70af794b7622a79cb37fc0b6aa5d79540ac2cc1f2e"
  },
  "sensitivity": "CONFIDENTIAL",
  "language": [
    "en",
    "hy"
  ],
  "last_verified": "2026-09-16",
  "freshness": {
    "state": "unverified"
  }
}
