{
  "id": "HN-KNOW-CMD-ACTIONS",
  "title": "WORKSPACE/Actions.md",
  "domain": "operational coordination",
  "owner": "HOUSE_NET_OWNER",
  "status": "draft",
  "source": {
    "type": "repository",
    "uri": "repo://HouseNet-Projects/house-net-command-center/WORKSPACE/Actions.md@9e15dd1c00f8c9a5c4a531fa45e7b4c99fce6b8f",
    "hash": "99dc1de795169173acf4e8edcd9f78bc6e6b3232b28280cb121d43450f629262"
  },
  "sensitivity": "CONFIDENTIAL",
  "language": [
    "en",
    "hy"
  ],
  "last_verified": "2026-09-16",
  "freshness": {
    "state": "unverified"
  }
}
